id	conversation_id	created_at	date	time	timezone	user_id	username	name	place	tweet	language	mentions	urls	photos	replies_count	retweets_count	likes_count	hashtags	cashtags	link	retweet	quote_url	video	thumbnail	near	geo	source	user_rt_id	user_rt	retweet_id	reply_to	retweet_date	translate	trans_src	trans_dest
1334222123900997632	1334222123900997632	2020-12-02 14:45:17 -05	2020-12-02	14:45:17	-0500	17548080	diarioelheraldo	Diario El Heraldo		La dependencia agregó que se espera recibir una primera cantidad de 250.000 dosis en diciembre  #pandemia #coronavirus #Covid19 #Pfizer   https://t.co/Qv5xm3OW7h	es	[]	['https://www.elheraldo.hn/mundo/1426607-466/m%C3%A9xico-firma-contrato-con-pfizer-para-344-millones-de-vacunas-contra-covid-19']	[]	0	0	5	['pandemia', 'coronavirus', 'covid19', 'pfizer']	[]	https://twitter.com/diarioelheraldo/status/1334222123900997632	False		0		Honduras,Tegucigalpa						[]				
1334214235434455051	1334214235434455051	2020-12-02 14:13:56 -05	2020-12-02	14:13:56	-0500	142550188	xiomaradanelia	Xiomara Orellana		Al 30/11/2020, Gobierno reporta un acumulado de 108,253 casos COVID-19 en Honduras. Mayoría de pacientes tiene entre 21 a 40 años. A 265 días del inicio de la pandemia y pese al subregistro, tasa de letalidad es del 2.7%, la más alta de Centroamérica.	es	[]	[]	[]	0	0	2	[]	[]	https://twitter.com/XiomaraDanelia/status/1334214235434455051	False		0		Honduras,Tegucigalpa						[]				
1334194460448714752	1334194460448714752	2020-12-02 12:55:22 -05	2020-12-02	12:55:22	-0500	17548080	diarioelheraldo	Diario El Heraldo		#LoÚltimo  Casos de covid-19 en las Américas aumentaron casi 30% en noviembre 🦠🦠😷😷  #ops #pandemia #coronavirus #COVID19  https://t.co/GVY5ViR2X1	es	[]	[]	['https://pbs.twimg.com/media/EoQCxotW8AE4EXs.jpg']	0	0	2	['loúltimo', 'ops', 'pandemia', 'coronavirus', 'covid19']	[]	https://twitter.com/diarioelheraldo/status/1334194460448714752	False		1	https://pbs.twimg.com/media/EoQCxotW8AE4EXs.jpg	Honduras,Tegucigalpa						[]				
1334176176198324225	1334176176198324225	2020-12-02 11:42:42 -05	2020-12-02	11:42:42	-0500	58046607	procesodigital	Proceso Digital		#MUNDO La ONU reúne a un centenar de líderes mundiales para discutir la pandemia  https://t.co/aSf3dyNRAG  https://t.co/M7pAIMb487	es	[]	['https://bit.ly/3qmhNTC']	['https://pbs.twimg.com/media/EoPyKKQXcAUCRch.jpg']	0	0	0	['mundo']	[]	https://twitter.com/ProcesoDigital/status/1334176176198324225	False		1	https://pbs.twimg.com/media/EoPyKKQXcAUCRch.jpg	Honduras,Tegucigalpa						[]				
1334176006509359106	1334176006509359106	2020-12-02 11:42:02 -05	2020-12-02	11:42:02	-0500	58046607	procesodigital	Proceso Digital		#PANDEMIA Los casos globales ascienden a 63.3 millones, 490,000 en la última jornada  https://t.co/IHrQl9jmr2	es	[]	['https://bit.ly/37ockCW']	[]	0	0	0	['pandemia']	[]	https://twitter.com/ProcesoDigital/status/1334176006509359106	False		0		Honduras,Tegucigalpa						[]				
1334170261944414211	1334170261944414211	2020-12-02 11:19:12 -05	2020-12-02	11:19:12	-0500	17548080	diarioelheraldo	Diario El Heraldo		Así es el hospital para futuras crisis que inauguró Madrid. El Isabel Zendal podrá recibir los primeros pacientes la próxima semana 🦠🦠  #pandemia #coronavirus #COVID19 #madrid  https://t.co/aCtPDsjVlJ	es	[]	[]	['https://pbs.twimg.com/media/EoPswNMXYAEs04g.jpg', 'https://pbs.twimg.com/media/EoPswNeXMAYxpdF.jpg', 'https://pbs.twimg.com/media/EoPswNOXMAAaIab.jpg', 'https://pbs.twimg.com/media/EoPswNLW4AEVAU1.jpg']	2	0	1	['pandemia', 'coronavirus', 'covid19', 'madrid']	[]	https://twitter.com/diarioelheraldo/status/1334170261944414211	False		1	https://pbs.twimg.com/media/EoPswNMXYAEs04g.jpg	Honduras,Tegucigalpa						[]				
1334164263871590404	1334164263871590404	2020-12-02 10:55:22 -05	2020-12-02	10:55:22	-0500	17548080	diarioelheraldo	Diario El Heraldo		#Estápasando Entre los países más golpeados, Bélgica registra la mayor tasa de mortalidad, seguido de Perú, España e Italia 🦠😷  #pandemia #coronavirus #COVID19  https://t.co/T8hFl4at4A	es	[]	[]	['https://pbs.twimg.com/media/EoPnUFVW8AEC2Pn.jpg']	0	0	1	['estápasando', 'pandemia', 'coronavirus', 'covid19']	[]	https://twitter.com/diarioelheraldo/status/1334164263871590404	False		1	https://pbs.twimg.com/media/EoPnUFVW8AEC2Pn.jpg	Honduras,Tegucigalpa						[]				
1334159218484662272	1334159218484662272	2020-12-02 10:35:19 -05	2020-12-02	10:35:19	-0500	17548080	diarioelheraldo	Diario El Heraldo		Los estudiantes del sistema público retornarán a las aulas. Vea aquí los detalles 👇  #Honduras #pandemia #coronavirus #añoescolar   https://t.co/efRfNBFDSr	es	[]	['https://www.elheraldo.hn/pais/1426460-466/semipresencial-se-impartir%C3%A1-clases-en-el-a%C3%B1o-escolar-de-2021']	[]	0	0	1	['honduras', 'pandemia', 'coronavirus', 'añoescolar']	[]	https://twitter.com/diarioelheraldo/status/1334159218484662272	False		0		Honduras,Tegucigalpa						[]				
1334141918259933184	1334141918259933184	2020-12-02 09:26:35 -05	2020-12-02	09:26:35	-0500	1214312413035556865	bancocentral_hn	Banco Central de Honduras		Para atender las emergencias provocadas por la pandemia del COVID-19 y por el paso de los fenómenos naturales ETA e IOTA, el #BCH aprueba tercera facilidad crediticia a SEFIN, por alrededor de L5,600 millones; totalizando a la fecha un monto de L11,124 millones.  https://t.co/RanT05lmHL	es	[]	[]	['https://pbs.twimg.com/media/EoPTAT2XYAAP2Wc.jpg']	1	6	6	['bch']	[]	https://twitter.com/BancoCentral_HN/status/1334141918259933184	False		1	https://pbs.twimg.com/media/EoPTAT2XYAAP2Wc.jpg	Honduras,Tegucigalpa						[]				
1334140389503152134	1334140389503152134	2020-12-02 09:20:30 -05	2020-12-02	09:20:30	-0500	17548080	diarioelheraldo	Diario El Heraldo		Los países que más fallecidos registraron según los últimos balances oficiales son Estados Unidos, México e Italia 🦠  #pandemia #coronavirus #COVID19 #mexico #italia #EEUU   https://t.co/xkjnccOQqQ	es	[]	['https://www.elheraldo.hn/mundo/1426521-466/coronavirus-suma-1482240-mas-63-millones-mundo']	[]	0	0	1	['pandemia', 'coronavirus', 'covid19', 'mexico', 'italia', 'eeuu']	[]	https://twitter.com/diarioelheraldo/status/1334140389503152134	False		0		Honduras,Tegucigalpa						[]				
1334134107203362817	1334134107203362817	2020-12-02 08:55:32 -05	2020-12-02	08:55:32	-0500	17548080	diarioelheraldo	Diario El Heraldo		Tras aprobar el miércoles la distribución masiva de la vacuna de Pfizer/BioNTech, el Reino Unido se dispone a desplegar la primera campaña en un país occidental de vacunación contra el coronavirus  #pandemia #coronavirus #COVID19 #ReinoUnido #Pfizer #Biontech  https://t.co/tWDWkBEmyF	es	[]	[]	['https://pbs.twimg.com/media/EoPL5B_XMAAoWjA.jpg']	0	0	2	['pandemia', 'coronavirus', 'covid19', 'reinounido', 'pfizer', 'biontech']	[]	https://twitter.com/diarioelheraldo/status/1334134107203362817	False		1	https://pbs.twimg.com/media/EoPL5B_XMAAoWjA.jpg	Honduras,Tegucigalpa						[]				
1334129155915583488	1334129155915583488	2020-12-02 08:35:52 -05	2020-12-02	08:35:52	-0500	17548080	diarioelheraldo	Diario El Heraldo		Pfizer y BioNTech anunciaron el miércoles que recibieron permiso para el uso de emergencia de su vacuna contra el covid-19  #pandemia #coronavirus #COVID19 #Pfizer #Biontech   https://t.co/Esw5OvNcBz	es	[]	['https://www.elheraldo.hn/mundo/1426513-466/gran-bretana-autoriza-vacuna-pfizer-covid-19']	[]	0	1	3	['pandemia', 'coronavirus', 'covid19', 'pfizer', 'biontech']	[]	https://twitter.com/diarioelheraldo/status/1334129155915583488	False		0		Honduras,Tegucigalpa						[]				
1334058122743345158	1334058122743345158	2020-12-02 03:53:36 -05	2020-12-02	03:53:36	-0500	549455191	peiohr	Peio H. Riaño		Más hielo, más Navidad  La pandemia no frena los planes festivos diseñados por Almeida para Madrid, los amplía.  https://t.co/8vhw224yl7	es	[]	['https://elpais.com/espana/madrid/2020-12-01/almeida-amplia-la-apertura-de-la-mayor-pista-de-hielo-de-la-navidad.html']	[]	0	3	1	[]	[]	https://twitter.com/PeioHR/status/1334058122743345158	False		0		Honduras,Tegucigalpa						[]				
1334029532718788608	1334029532718788608	2020-12-02 02:00:00 -05	2020-12-02	02:00:00	-0500	17548080	diarioelheraldo	Diario El Heraldo		Si hubiera que elegir la palabra que más sobresalió en 2020, ¿cuál sería?  #pandemia #coronavirus #COVID19   https://t.co/4LdYAhnD0N	es	[]	['https://www.elheraldo.hn/queondaconesto/1426110-466/y-la-palabra-del-a%C3%B1o-es-pandemia']	[]	1	0	2	['pandemia', 'coronavirus', 'covid19']	[]	https://twitter.com/diarioelheraldo/status/1334029532718788608	False		0		Honduras,Tegucigalpa						[]				
1334018578115424256	1334018578115424256	2020-12-02 01:16:28 -05	2020-12-02	01:16:28	-0500	3904830072	ddiazmejia	Dany Diaz Mejia		¿Y en Centroamérica cómo nos está yendo con los programas sociales para los más vulnerables? #COVID19 #Pandemia	es	[]	[]	[]	1	0	0	['covid19', 'pandemia']	[]	https://twitter.com/ddiazmejia/status/1334018578115424256	False	https://twitter.com/ewarren/status/1333873311856648194	0		Honduras,Tegucigalpa						[]				
1334012136218120194	1334012136218120194	2020-12-02 00:50:52 -05	2020-12-02	00:50:52	-0500	217152506	daniplanells	Daniela Planells		Mi acompañante de todos mis días laborales durante la pandemia, Spotify  https://t.co/9VURa2xs7P	es	[]	[]	['https://pbs.twimg.com/media/EoNc9mLWEAANRSj.jpg']	0	0	0	[]	[]	https://twitter.com/DaniPlanells/status/1334012136218120194	False		1	https://pbs.twimg.com/media/EoNc9mLWEAANRSj.jpg	Honduras,Tegucigalpa						[]				
1334004373047959552	1334004373047959552	2020-12-02 00:20:01 -05	2020-12-02	00:20:01	-0500	972804638	televicentrohn	Televicentro HN		Desde el inicio de la pandemia, unos 67,660 inmigrantes indocumentados fueron sometidos a la prueba de detección del virus en los centros de ICE .  https://t.co/KFVzasa7pF	es	[]	['https://www.tunota.com/mas-de-7500-migrantes-bajo-custodia-de-ice-dieron-positivo-de-covid-19']	[]	0	0	0	[]	[]	https://twitter.com/televicentrohn/status/1334004373047959552	False		0		Honduras,Tegucigalpa						[]				
1333967732488998912	1333967732488998912	2020-12-01 21:54:26 -05	2020-12-01	21:54:26	-0500	50879461	dina_ayala	Elizabeth ✨		Decorando todo de navidad y preparando para que sea un mes bonito a pesar de la pandemia ☺️🎅🎉	es	[]	[]	[]	0	0	5	[]	[]	https://twitter.com/Dina_Ayala/status/1333967732488998912	False		0		Honduras,Tegucigalpa						[]				
1333964502812024833	1333964502812024833	2020-12-01 21:41:35 -05	2020-12-01	21:41:35	-0500	17548080	diarioelheraldo	Diario El Heraldo		#LoÚltimo | La economía australiana se contrajo un 7% en el segundo trimestre de 2020 y 0,3% en el primer trimestre, como consecuencia de la pandemia del nuevo coronavirus.  #Australia #PIB #Economia  https://t.co/MJtQ8PJslN	es	[]	[]	['https://pbs.twimg.com/media/EoMxjJHWEAE051K.jpg']	1	0	1	['loúltimo', 'australia', 'pib', 'economia']	[]	https://twitter.com/diarioelheraldo/status/1333964502812024833	False		1	https://pbs.twimg.com/media/EoMxjJHWEAE051K.jpg	Honduras,Tegucigalpa						[]				
1333947768688300035	1333947768688300035	2020-12-01 20:35:06 -05	2020-12-01	20:35:06	-0500	2378172633	guillermogiron3	José Guillermo Girón		"La violencia, nunca es la solución a nada. ¿Cuándo entenderá esto la fuerza policial de mi país? , el derecho a la protesta está estipulado en nuestra Constitución. ""El desalojo en tiempo de pandemía y después de 2 huracanes, es deleznable""."	es	[]	[]	[]	0	0	6	[]	[]	https://twitter.com/GuillermoGiron3/status/1333947768688300035	False		0		Honduras,Tegucigalpa						[]				
1333938939074392065	1333938939074392065	2020-12-01 20:00:01 -05	2020-12-01	20:00:01	-0500	17548080	diarioelheraldo	Diario El Heraldo		Mucha gente que sigue teniendo trabajo y seguridad económica se siente culpable en medio de tantas penurias asociadas con el virus  #COVID19 #Mundo #Pandemia    https://t.co/ewiEk5BdBa	es	[]	['https://www.elheraldo.hn/mundo/1426364-466/coronavirus-la-culpa-del-que-conserva-su-trabajo']	[]	0	0	2	['covid19', 'mundo', 'pandemia']	[]	https://twitter.com/diarioelheraldo/status/1333938939074392065	False		0		Honduras,Tegucigalpa						[]				
1333936358721777671	1333936358721777671	2020-12-01 19:49:45 -05	2020-12-01	19:49:45	-0500	58046607	procesodigital	Proceso Digital		#Pandemia . La COVID-19 ya es la primera causa de muerte en Costa Rica  https://t.co/Gvttk0kOds	es	[]	['https://bit.ly/3qdw1pL']	[]	0	0	0	['pandemia']	[]	https://twitter.com/ProcesoDigital/status/1333936358721777671	False		0		Honduras,Tegucigalpa						[]				
1333935160283238403	1333935160283238403	2020-12-01 19:45:00 -05	2020-12-01	19:45:00	-0500	17548080	diarioelheraldo	Diario El Heraldo		El reconocido pintor Guy Stanley Philoche quería comprarse un reloj caro después de una exitosa muestra en una galería. Pero llegó la pandemia del coronavirus y pensó en todos los artistas que no tenían la misma suerte que él.  #Mundo #Arte #Pintor    https://t.co/c1KWgYbGj0	es	[]	['https://www.elheraldo.hn/mundo/1426434-466/pandemia-pintor-solidario-compra-obras-de-otros-artistas']	[]	0	0	1	['mundo', 'arte', 'pintor']	[]	https://twitter.com/diarioelheraldo/status/1333935160283238403	False		0		Honduras,Tegucigalpa						[]				
1333900180396126209	1333900180396126209	2020-12-01 17:26:00 -05	2020-12-01	17:26:00	-0500	17548080	diarioelheraldo	Diario El Heraldo		#LoÚltimo | El presidente electo Joe Biden presentó el martes a sus principales asesores que, aseguró, ayudarán a su gobierno a reconstruir una economía vapuleada por la pandemia del coronavirus.  #Biden #Economía #EEUU  https://t.co/w1REJ244VN	es	[]	[]	['https://pbs.twimg.com/media/EoL22ZKXYAI8iSl.jpg']	0	0	5	['loúltimo', 'biden', 'economía', 'eeuu']	[]	https://twitter.com/diarioelheraldo/status/1333900180396126209	False		1	https://pbs.twimg.com/media/EoL22ZKXYAI8iSl.jpg	Honduras,Tegucigalpa						[]				
1333887908579860481	1333887908579860481	2020-12-01 16:37:14 -05	2020-12-01	16:37:14	-0500	17548080	diarioelheraldo	Diario El Heraldo		"Madrid inauguró este martes un nuevo hospital público, conocido como ""el hospital de pandemias"", un gigantesco y controvertido complejo sanitario construido en tres meses por el gobierno regional.   #pandemia #hospital #Madrid #coronavirus #covid19 #comparte  https://t.co/mLodtIAvHM"	es	[]	[]	[]	2	1	3	['pandemia', 'hospital', 'madrid', 'coronavirus', 'covid19', 'comparte']	[]	https://twitter.com/diarioelheraldo/status/1333887908579860481	False		1	https://pbs.twimg.com/ext_tw_video_thumb/1333887351165169665/pu/img/fSRIQvKiumhrTPq1.jpg	Honduras,Tegucigalpa						[]				
1333883945314889730	1333868497626157059	2020-12-01 16:21:29 -05	2020-12-01	16:21:29	-0500	368522684	lazo_edas	Edas Fernando Lazo		@careca_88 La educación en Honduras está por los suelos. La pandemia está terminando de hundir todo eso.	es	[]	[]	[]	0	1	1	[]	[]	https://twitter.com/lazo_edas/status/1333883945314889730	False		0		Honduras,Tegucigalpa						[{'screen_name': 'careca_88', 'name': 'Reinaldo carrasco', 'id': '268090875'}]				
1333876621850316801	1333876621850316801	2020-12-01 15:52:23 -05	2020-12-01	15:52:23	-0500	17548080	diarioelheraldo	Diario El Heraldo		Desde que comenzó la pandemia del coronavirus, pacientes hablan de la culpa que sienten porque les va bien...  #pandemia #coronavirus #COVID19   https://t.co/ewiEk5BdBa	es	[]	['https://www.elheraldo.hn/mundo/1426364-466/coronavirus-la-culpa-del-que-conserva-su-trabajo']	[]	0	0	0	['pandemia', 'coronavirus', 'covid19']	[]	https://twitter.com/diarioelheraldo/status/1333876621850316801	False		0		Honduras,Tegucigalpa						[]				
1333876042591850496	1333876042591850496	2020-12-01 15:50:05 -05	2020-12-01	15:50:05	-0500	972804638	televicentrohn	Televicentro HN		Según el dirigente, los periodistas han enfrentado también en primera línea la pandemia por coronavirus en Honduras, mira aquí lo que pide:   https://t.co/KMdMIDD1dh	es	[]	['https://www.tunota.com/presidente-del-cph-pide-se-incluya-a-periodistas-en-inmunizacion-contra-el-covid']	[]	1	0	1	[]	[]	https://twitter.com/televicentrohn/status/1333876042591850496	False		0		Honduras,Tegucigalpa						[]				
1333875951910973441	1333875951910973441	2020-12-01 15:49:43 -05	2020-12-01	15:49:43	-0500	17548080	diarioelheraldo	Diario El Heraldo		El lunes, la aerolínea Jet Blue Airways dijo que las “tendencias de reservaciones siguen volátiles”   #EEUU #pandemia #coronavirus    https://t.co/m2Dq5mmueT	es	[]	['https://www.elheraldo.hn/mundo/1426355-466/aumentan-viajes-en-eeuu-pese-a-advertencias-por-pandemia']	[]	0	1	0	['eeuu', 'pandemia', 'coronavirus']	[]	https://twitter.com/diarioelheraldo/status/1333875951910973441	False		0		Honduras,Tegucigalpa						[]				
1333873008587513856	1333873008587513856	2020-12-01 15:38:02 -05	2020-12-01	15:38:02	-0500	17548080	diarioelheraldo	Diario El Heraldo		#fotos Al menos un 70 por ciento de la población de Honduras podría ser vacunada contra el covid-19 a partir del próximo año. Esto es lo que debe saber 🦠💉  #Honduras #pandemia #coronavirus #COVID19   https://t.co/X2DfK5Nwpj	es	[]	['https://www.elheraldo.hn/fotogalerias/1426333-468/7-de-10-hondurenos-serian-vacunados-covid-como-sera-posible']	[]	0	0	0	['fotos', 'honduras', 'pandemia', 'coronavirus', 'covid19']	[]	https://twitter.com/diarioelheraldo/status/1333873008587513856	False		0		Honduras,Tegucigalpa						[]				
1333871282753052677	1333871282753052677	2020-12-01 15:31:10 -05	2020-12-01	15:31:10	-0500	1379349216	mariogombu	Mario Gombu		2 Huracanes en 2 Semanas. Una Pandemia. Un país en quiebra. Un Estado Fallido. Una Dictadura que no genera certidumbre de elecciones libres.  Los pobres no son los culpables de querer buscar y rebuscarse como sea el pan de cada día ante un país saqueado y sin oportunidades.  https://t.co/nncZQGeKCL	es	[]	[]	['https://pbs.twimg.com/media/EoLc3OIWMAAvjha.jpg']	0	0	0	[]	[]	https://twitter.com/MariogomBu/status/1333871282753052677	False		1	https://pbs.twimg.com/media/EoLc3OIWMAAvjha.jpg	Honduras,Tegucigalpa						[]				
1333870250274775040	1333870250274775040	2020-12-01 15:27:04 -05	2020-12-01	15:27:04	-0500	1250938374443143168	arturovijil2	Arturo vijil		Para mitigar el desorden administrativo en manejo de pandemia, ETA Y IOTA y ante la caída de los ingresos fiscales, se debe reducir el gasto corriente y aumentar presupuesto para infraestructura y salud; gobierno debe demostrar patriotismo y sentido común en manejo de recursos!!	es	[]	[]	[]	0	0	2	[]	[]	https://twitter.com/Arturovijil2/status/1333870250274775040	False		0		Honduras,Tegucigalpa						[]				
1333858773845250048	1333858773845250048	2020-12-01 14:41:28 -05	2020-12-01	14:41:28	-0500	110784450	ale_galo	Alejandro		😶 JOH es peor que un huracan y una pandemia juntos! Por mas Cristiano que yo sea ese es un hdp...	es	[]	[]	[]	0	0	1	[]	[]	https://twitter.com/ale_galo/status/1333858773845250048	False	https://twitter.com/Fedalvarf/status/1333774444641267712	0		Honduras,Tegucigalpa						[]				
1333855340463607814	1333855340463607814	2020-12-01 14:27:49 -05	2020-12-01	14:27:49	-0500	1687083499	vocerop	El Informativo HN		Presidente Hernández apoya iniciativa del secretario de ONU a favor del alivio de deuda de países afectados por pandemia y tormentas – El  https://t.co/lAc4C7HmSV  https://t.co/xfmsN8uhnS	es	[]	['http://informativo.hn', 'https://www.elinformativo.hn/archivos/89628']	[]	0	0	0	[]	[]	https://twitter.com/VoceroP/status/1333855340463607814	False		0		Honduras,Tegucigalpa						[]				
1333853263041589254	1333853263041589254	2020-12-01 14:19:34 -05	2020-12-01	14:19:34	-0500	153178321	alexitac88	Miss Pandemia ♫ ♥		Hahahahaha me representa lol	tl	[]	[]	[]	0	0	2	[]	[]	https://twitter.com/AlexitaC88/status/1333853263041589254	False	https://twitter.com/OrageTats/status/1333844579997638660	0		Honduras,Tegucigalpa						[]				
1333852531538223108	1333852531538223108	2020-12-01 14:16:39 -05	2020-12-01	14:16:39	-0500	17548080	diarioelheraldo	Diario El Heraldo		La Torre Eiffel, que permanece cerrada desde el 30 de octubre debido al reconfinamiento impuesto en Francia para frenar la pandemia del covid-19, reabrirá sus puertas a partir del 16 de diciembre.  #pandemia #COVID19 #coronavirus #eiffel #eiffeltower  https://t.co/kLXUnYB3qi	es	[]	[]	['https://pbs.twimg.com/media/EoLLy3EXUAM9iaF.jpg']	0	1	4	['pandemia', 'covid19', 'coronavirus', 'eiffel', 'eiffeltower']	[]	https://twitter.com/diarioelheraldo/status/1333852531538223108	False		1	https://pbs.twimg.com/media/EoLLy3EXUAM9iaF.jpg	Honduras,Tegucigalpa						[]				
1333849469683720192	1333849469683720192	2020-12-01 14:04:29 -05	2020-12-01	14:04:29	-0500	17548080	diarioelheraldo	Diario El Heraldo		Los resultados positivos de las vacunas más avanzadas que han culminado sus fases de investigación y desarrollo dan una esperanza de poder frenar la pandemia en el mundo 🦠💉  #honduras #pandemia #coronavirus #COVID19   https://t.co/Zig7UzGLOx	es	[]	['https://www.elheraldo.hn/pais/1426199-466/buscar%C3%A1n-vacunar-al-70-de-hondure%C3%B1os-contra-el-covid-19']	[]	0	1	1	['honduras', 'pandemia', 'coronavirus', 'covid19']	[]	https://twitter.com/diarioelheraldo/status/1333849469683720192	False		0		Honduras,Tegucigalpa						[]				
1333847229858197509	1333847229858197509	2020-12-01 13:55:35 -05	2020-12-01	13:55:35	-0500	2565999637	cattrachas	CATTRACHAS		Hablemos de la pandemia del VIH, sin mentiras ni prejuicios que discriminan.  #VIHPositivo	es	[]	[]	[]	0	0	2	['vihpositivo']	[]	https://twitter.com/CATTRACHAS/status/1333847229858197509	False		0		Honduras,Tegucigalpa						[]				
1333843469190750208	1333843469190750208	2020-12-01 13:40:39 -05	2020-12-01	13:40:39	-0500	1181737935722422272	juliolopezro	Julio López		Lamentable lo sucedido hace unas horas en San Pedro Sula.   ¿Un desalojo en medio de una pandemia, en una zona afectada por dos desastres naturales?  Esto jamás debería de terminar en heridos, mucho menos muertos. Caótico.   https://t.co/YISYGv9CLU	es	[]	['https://www.tunota.com/video-desalojo-lavadores-de-carros-san-pedro-sula-sucesos-honduras-enfrentamiento-policial']	[]	0	0	7	[]	[]	https://twitter.com/JulioLopezRo/status/1333843469190750208	False		0		Honduras,Tegucigalpa						[]				
1333837716841263105	1333837716841263105	2020-12-01 13:17:47 -05	2020-12-01	13:17:47	-0500	17548080	diarioelheraldo	Diario El Heraldo		La investigación comenzó después de que varias personas denunciaran en las redes sociales el hallazgo  #ElSalvador #pandemia #coronavirus #COVID19 #NayibBukele   https://t.co/by5knT4QNY	es	[]	['https://www.elheraldo.hn/mundo/1426305-466/capturan-alcalde-salvadoreno-por-apropiarse-alimentos-covid-19']	[]	1	0	3	['elsalvador', 'pandemia', 'coronavirus', 'covid19', 'nayibbukele']	[]	https://twitter.com/diarioelheraldo/status/1333837716841263105	False		0		Honduras,Tegucigalpa						[]				
1333827619708678146	1333827619708678146	2020-12-01 12:37:40 -05	2020-12-01	12:37:40	-0500	17548080	diarioelheraldo	Diario El Heraldo		Así luce el complejo sanitario Isabel Zendal que fue inaugurado este martes en Madrid por las autoridades regionales. Tuvo un costo de más de 100 millones de euros (120 millones de dólares)  #madrid #Pandemia #coronavirus #COVID19 #isabelzendal  https://t.co/7YVu2pSrOC	es	[]	[]	['https://pbs.twimg.com/media/EoK1Ha2XcAITLgG.jpg', 'https://pbs.twimg.com/media/EoK1Ha3W4AIMUfi.jpg', 'https://pbs.twimg.com/media/EoK1Ha6XEAIA9vv.jpg', 'https://pbs.twimg.com/media/EoK1Ha5WMAM2cDE.jpg']	2	0	2	['madrid', 'pandemia', 'coronavirus', 'covid19', 'isabelzendal']	[]	https://twitter.com/diarioelheraldo/status/1333827619708678146	False		1	https://pbs.twimg.com/media/EoK1Ha2XcAITLgG.jpg	Honduras,Tegucigalpa						[]				
1333826605131702272	1333826605131702272	2020-12-01 12:33:38 -05	2020-12-01	12:33:38	-0500	1055726994	cnajera12	Cristian Nájera		Completa insensatez el desalojo en Río Blanco por algunas razones:  1) En medio de una pandemia  2) A afectados por huracanes  3) Uso excesivo de fuerza  Al final, el saldo es una persona muerta. En otro país, el funcionario municipal estaría cesado e investigado ipso facto.	es	[]	[]	[]	20	39	219	[]	[]	https://twitter.com/Cnajera12/status/1333826605131702272	False		0		Honduras,Tegucigalpa						[]				
1333823018020302848	1333823018020302848	2020-12-01 12:19:23 -05	2020-12-01	12:19:23	-0500	58046607	procesodigital	Proceso Digital		#aldía La pandemia alcanza los 62.6 millones de casos, con 1.4 millones de muertes  https://t.co/YvXHDzycu2	es	[]	['https://bit.ly/3o9NddV']	[]	0	0	2	['aldía']	[]	https://twitter.com/ProcesoDigital/status/1333823018020302848	False		0		Honduras,Tegucigalpa						[]				
1333818929056280576	1333818929056280576	2020-12-01 12:03:08 -05	2020-12-01	12:03:08	-0500	1079540744556298241	fredyhtejada1	Fredy H. Tejada F.		TASA CERO. A los pequeños productores del país se les debería de dota de capital de trabajo a una tasa 0%. No hay otra forma de reflotar la economía. Son miles de emprendedores que hoy están destruidos por dos huracanes y un cierre sin razón por la pandemia. Adnnews@  https://t.co/7cKN14czgo	es	[]	[]	['https://pbs.twimg.com/media/EoKsnKaXUAAFKZd.jpg']	0	0	0	[]	[]	https://twitter.com/FredyHTejada1/status/1333818929056280576	False		1	https://pbs.twimg.com/media/EoKsnKaXUAAFKZd.jpg	Honduras,Tegucigalpa						[]				
1333817214114283521	1333817214114283521	2020-12-01 11:56:19 -05	2020-12-01	11:56:19	-0500	94437807	hondudiario	Hondudiario.com		"ONU advierte sobre una ""gran crisis de deuda soberana"" en Latinoamérica debido a la pandemia -  https://t.co/1L1zQsTWBV  https://t.co/EAZ4SLgkeG"	es	[]	['https://bit.ly/37q34hB']	['https://pbs.twimg.com/media/EoKrsBNUwAA6pQJ.jpg']	0	0	0	[]	[]	https://twitter.com/hondudiario/status/1333817214114283521	False		1	https://pbs.twimg.com/media/EoKrsBNUwAA6pQJ.jpg	Honduras,Tegucigalpa						[]				
