id	conversation_id	created_at	date	time	timezone	user_id	username	name	place	tweet	language	mentions	urls	photos	replies_count	retweets_count	likes_count	hashtags	cashtags	link	retweet	quote_url	video	thumbnail	near	geo	source	user_rt_id	user_rt	retweet_id	reply_to	retweet_date	translate	trans_src	trans_dest
1331978696727597060	1331978696727597060	2020-11-26 10:10:42 -05	2020-11-26	10:10:42	-0500	153178321	alexitac88	Miss Pandemia ♫ ♥		Quiero granita de yogurt de fresa :(	es	[]	[]	[]	1	0	1	[]	[]	https://twitter.com/AlexitaC88/status/1331978696727597060	False		0		Honduras,Tegucigalpa						[]				
1331969249154359297	1331969249154359297	2020-11-26 09:33:10 -05	2020-11-26	09:33:10	-0500	58046607	procesodigital	Proceso Digital		#ACTUALIDAD / #Pandemia y emergencia climática provocarán pérdida de 800 mil #empleos en #Honduras  https://t.co/Fj8N4Nkfqo  #ProcesoDigital  https://t.co/okLzxzH8Tq	es	[]	['https://bit.ly/3q2g19S']	['https://pbs.twimg.com/media/Enwa9-5W4AIh5cw.jpg']	0	0	1	['actualidad', 'pandemia', 'empleos', 'honduras', 'procesodigital']	[]	https://twitter.com/ProcesoDigital/status/1331969249154359297	False		1	https://pbs.twimg.com/media/Enwa9-5W4AIh5cw.jpg	Honduras,Tegucigalpa						[]				
1331963862539784198	1331963862539784198	2020-11-26 09:11:46 -05	2020-11-26	09:11:46	-0500	153178321	alexitac88	Miss Pandemia ♫ ♥		Mi tl es una combinación de : gente super feliz deseando buen día, y gente super depresiva 😭😭😭😭	es	[]	[]	[]	0	0	0	[]	[]	https://twitter.com/AlexitaC88/status/1331963862539784198	False		0		Honduras,Tegucigalpa						[]				
1331963777756131328	1331446117540663300	2020-11-26 09:11:25 -05	2020-11-26	09:11:25	-0500	1265534408	carlostorres_m	Carlos Torres		@JackyRedondo La incapacidad del gobierno, de todos sus funcionarios puestos de dedo, queda en visto en toda Honduras y el mundo... Es una pena, una vergüenza, que todo el mal maneja de pandemia, meteoros, haya sido manejado con tanta incapacidad y corrupción sobretodo. VERGÜENZA	es	[]	[]	[]	0	0	0	[]	[]	https://twitter.com/carlostorres_m/status/1331963777756131328	False		0		Honduras,Tegucigalpa						[{'screen_name': 'JackyRedondo', 'name': 'Jaqueline Redondo', 'id': '353240509'}]				
1331958407817990145	1331937811797303299	2020-11-26 08:50:05 -05	2020-11-26	08:50:05	-0500	153178321	alexitac88	Miss Pandemia ♫ ♥		@Yoshisaur18 Hahahahahahahaha siii	tl	[]	[]	[]	0	0	1	[]	[]	https://twitter.com/AlexitaC88/status/1331958407817990145	False		0		Honduras,Tegucigalpa						[{'screen_name': 'Yoshisaur18', 'name': 'Yoshi', 'id': '1325071719565025281'}]				
1331953252410253316	1331937811797303299	2020-11-26 08:29:36 -05	2020-11-26	08:29:36	-0500	153178321	alexitac88	Miss Pandemia ♫ ♥		@Yoshisaur18 Hahahahahahaha literal no pueden ni caminar! Lol	tl	[]	[]	[]	1	0	0	[]	[]	https://twitter.com/AlexitaC88/status/1331953252410253316	False		0		Honduras,Tegucigalpa						[{'screen_name': 'Yoshisaur18', 'name': 'Yoshi', 'id': '1325071719565025281'}]				
1331952921932673024	1331947852373876737	2020-11-26 08:28:17 -05	2020-11-26	08:28:17	-0500	153178321	alexitac88	Miss Pandemia ♫ ♥		@Jo_c_carlos @PoliciaHonduras @Congrezoonacio1 Es que es rata cachureca está difícil de matar!	pt	[]	[]	[]	1	0	1	[]	[]	https://twitter.com/AlexitaC88/status/1331952921932673024	False		0		Honduras,Tegucigalpa						[{'screen_name': 'Jo_c_carlos', 'name': 'Jo_c (En desbordamiento cafetero)', 'id': '271271800'}, {'screen_name': 'PoliciaHonduras', 'name': 'Policía Nacional de Honduras', 'id': '3223659392'}, {'screen_name': 'Congrezoonacio1', 'name': 'Congreso Nacional', 'id': '1113225500745453569'}]				
1331952650955448320	1331952650955448320	2020-11-26 08:27:13 -05	2020-11-26	08:27:13	-0500	153178321	alexitac88	Miss Pandemia ♫ ♥		A mí me alegra el día con sus vn largos!	es	[]	[]	[]	0	1	4	[]	[]	https://twitter.com/AlexitaC88/status/1331952650955448320	False	https://twitter.com/eleguiarte/status/1331461700017590276	0		Honduras,Tegucigalpa						[]				
1331944403745861632	1331944403745861632	2020-11-26 07:54:26 -05	2020-11-26	07:54:26	-0500	83612632	andylokoloko	q pena con la visita		Tengo que agradecer, que la pandemia no se ha llevado ningún familiar, que conseguí un trabajo a comienzo de año con el cual me siento feliz, y que nunca me faltó la comida en la mesa y la cermeza en la nevera, y que el amorsh volvió a mi vida ☺️😊	es	[]	[]	[]	0	1	47	[]	[]	https://twitter.com/andylokoloko/status/1331944403745861632	False	https://twitter.com/alialej/status/1331911967821492224	0		Honduras,Tegucigalpa						[]				
1331836330737762304	1331836330737762304	2020-11-26 00:45:00 -05	2020-11-26	00:45:00	-0500	17548080	diarioelheraldo	Diario El Heraldo		#Gráficos 📈📈 De una persona a tres, pero de tres a nueve, luego de nueve a 27... y aquí viene la explosión de casos: de 27 a 81, de 81 a 243, de 243 a 729, de 729 a 2,187... ¡2,187!  #pandemia #Honduras #coronavirus #COVID19 #UnidadDeDatosELHERALDO    https://t.co/ClkvVQ4qAW	es	[]	['https://www.elheraldo.hn/elheraldodata/1403044-528/covid-19-velocidad-r0-honduras']	[]	0	0	1	['gráficos', 'pandemia', 'honduras', 'coronavirus', 'covid19', 'unidaddedatoselheraldo']	[]	https://twitter.com/diarioelheraldo/status/1331836330737762304	False		0		Honduras,Tegucigalpa						[]				
1331832555738304512	1331832555738304512	2020-11-26 00:30:00 -05	2020-11-26	00:30:00	-0500	17548080	diarioelheraldo	Diario El Heraldo		#Gráficos 📈📈 Siete meses y medio le tomó al covid-19 penetrar en todos los municipios de Honduras...  #Honduras #pandemia #coronavirus #COVID19 #UnidadDeDatosELHERALDO    https://t.co/XBc8ygLJ82	es	[]	['https://www.elheraldo.hn/interactivos/1418586-529/municipios-covid-honduras-coronavirus-mapa']	[]	0	1	2	['gráficos', 'honduras', 'pandemia', 'coronavirus', 'covid19', 'unidaddedatoselheraldo']	[]	https://twitter.com/diarioelheraldo/status/1331832555738304512	False		0		Honduras,Tegucigalpa						[]				
1331825008725815299	1331825008725815299	2020-11-26 00:00:00 -05	2020-11-26	00:00:00	-0500	17548080	diarioelheraldo	Diario El Heraldo		La pandemia y la tecnología figuran entre las principales razones que frenan el deseo sexual  #sexoypareja #pandemia    https://t.co/6b0yRM2gRp	es	[]	['https://www.elheraldo.hn/otrassecciones/sexoypareja/1413642-466/10-razones-deseo-sexual-ha-bajado']	[]	0	0	1	['sexoypareja', 'pandemia']	[]	https://twitter.com/diarioelheraldo/status/1331825008725815299	False		0		Honduras,Tegucigalpa						[]				
1331818151613509632	1331818151613509632	2020-11-25 23:32:45 -05	2020-11-25	23:32:45	-0500	17548080	diarioelheraldo	Diario El Heraldo		#Gráficos 📊📈 La pandemia del coronavirus sigue dejando luto en las familias hondureñas. ¡Vea aquí los detalles!   #Honduras #pandemia #coronavirus #COVID19 #SINAGER   https://t.co/skcALM2a9I	es	[]	['https://www.elheraldo.hn/pais/1421088-466/honduras-acumula-nuevos-casos-de-covid-y-mas-muertes']	[]	0	0	0	['gráficos', 'honduras', 'pandemia', 'coronavirus', 'covid19', 'sinager']	[]	https://twitter.com/diarioelheraldo/status/1331818151613509632	False		0		Honduras,Tegucigalpa						[]				
1331815098801852419	1331815098801852419	2020-11-25 23:20:38 -05	2020-11-25	23:20:38	-0500	17548080	diarioelheraldo	Diario El Heraldo		Honduras ya suma 106,116 casos de coronavirus, según las autoridades del Sinager   #Honduras #pandemia #coronavirus #COVID19 #Comparte  https://t.co/slI68JOBRF	es	[]	[]	['https://pbs.twimg.com/media/EnuOxLCXcAAadOl.jpg']	0	0	0	['honduras', 'pandemia', 'coronavirus', 'covid19', 'comparte']	[]	https://twitter.com/diarioelheraldo/status/1331815098801852419	False		1	https://pbs.twimg.com/media/EnuOxLCXcAAadOl.jpg	Honduras,Tegucigalpa						[]				
1331814172271783936	1331814172271783936	2020-11-25 23:16:57 -05	2020-11-25	23:16:57	-0500	147338179	v4vilo	César | Vilo C-137		Cómo es posible que él va a sacar un segundo disco en lo que va de la pandemia? 🤔🤔  Y para un disco de @Tool yo tuve que esperar mas de 10 años.  ¿CUANTO TIEMPO LLEVAMOS EN PANDEMIA???? 😱🤯	es	[{'screen_name': 'tool', 'name': 'tool effing tool', 'id': '1737401'}]	[]	[]	1	0	0	[]	[]	https://twitter.com/V4Vilo/status/1331814172271783936	False	https://twitter.com/sanbenito/status/1331735084437823488	0		Honduras,Tegucigalpa						[]				
1331809908413513729	1331809908413513729	2020-11-25 23:00:00 -05	2020-11-25	23:00:00	-0500	17548080	diarioelheraldo	Diario El Heraldo		La Organización Mundial de la Salud elogió la forma como Suecia estaba manejando la pandemia  #pandemia #coronavirus #COVID19 #Honduras #OMS    https://t.co/DZLmgXXI4k	es	[]	['https://www.elheraldo.hn/especiales/coronavirus/1380908-528/coronavirus-honduras-modelo-sueco']	[]	0	1	0	['pandemia', 'coronavirus', 'covid19', 'honduras', 'oms']	[]	https://twitter.com/diarioelheraldo/status/1331809908413513729	False		0		Honduras,Tegucigalpa						[]				
1331797204466622465	1331792543705608192	2020-11-25 22:09:31 -05	2020-11-25	22:09:31	-0500	153178321	alexitac88	Miss Pandemia ♫ ♥		@sonya_joelle Ayñ hahahahahahaha	tl	[]	[]	[]	0	0	1	[]	[]	https://twitter.com/AlexitaC88/status/1331797204466622465	False		0		Honduras,Tegucigalpa						[{'screen_name': 'sonya_joelle', 'name': 'Joëlle', 'id': '3794006419'}]				
1331793560937635842	1331793560937635842	2020-11-25 21:55:03 -05	2020-11-25	21:55:03	-0500	1347706202	armandochtv	Armando Villanueva		El gran reto del Grupo Consultivo: Lograr el apoyo de la comunidad internacional, para la.reconstrucion nacional, en plena pandemia mundial por el Covid. Este jueves en CHTV, Milton Jiménez Puerto, integrante Grupo Consultivo. 7am.  https://t.co/7gQymlCztj	es	[]	['http://CHTV.hn']	[]	0	0	0	[]	[]	https://twitter.com/armandochtv/status/1331793560937635842	False		0		Honduras,Tegucigalpa						[]				
1331783080223395841	1331783080223395841	2020-11-25 21:13:24 -05	2020-11-25	21:13:24	-0500	94503257	jdavid504	Josué Osorio		"La última ocasión en que la universidad se ""preocupó"" por los docentes en la pandemia, nos mandaron un catálogo para comprar en Jetstereo 😂😂😂😂😂 no vuelvo a llenar encuestas 😁"	es	[]	[]	[]	0	0	1	[]	[]	https://twitter.com/jdavid504/status/1331783080223395841	False		0		Honduras,Tegucigalpa						[]				
1331775652710772737	1331775652710772737	2020-11-25 20:43:53 -05	2020-11-25	20:43:53	-0500	17548080	diarioelheraldo	Diario El Heraldo		#LOÚLTIMO EEUU registra más de 2.400 muertes de covid-19 en un día, la cifra más alta en 6 meses  #pandemia  #coronavirus  #COVID19  #EEUU  https://t.co/fAwU8WHh3d	es	[]	[]	['https://pbs.twimg.com/media/Entq4xaXcAEykFR.jpg']	0	1	2	['loúltimo', 'pandemia', 'coronavirus', 'covid19', 'eeuu']	[]	https://twitter.com/diarioelheraldo/status/1331775652710772737	False		1	https://pbs.twimg.com/media/Entq4xaXcAEykFR.jpg	Honduras,Tegucigalpa						[]				
1331766788577759233	1331766788577759233	2020-11-25 20:08:40 -05	2020-11-25	20:08:40	-0500	17548080	diarioelheraldo	Diario El Heraldo		"""Hoy anunciamos que Honduras tiene resuelto el tema de las vacunas para todo aquel compatriota que médicamente lo necesite"", aseguró el mandatario Juan Orlando Hernández. ¿Usted qué opina?   #Honduras #JOH #pandemia #coronavirus #Covid19  https://t.co/0qZlbjblLZ"	es	[]	[]	['https://pbs.twimg.com/media/Enti03dXIAAhg0S.jpg']	6	0	1	['honduras', 'joh', 'pandemia', 'coronavirus', 'covid19']	[]	https://twitter.com/diarioelheraldo/status/1331766788577759233	False		1	https://pbs.twimg.com/media/Enti03dXIAAhg0S.jpg	Honduras,Tegucigalpa						[]				
1331756294794076161	1331756294794076161	2020-11-25 19:26:58 -05	2020-11-25	19:26:58	-0500	248739609	hnellibertador	EL LIBERTADOR		HONDURAS / MÁS DE 65 MIL MUJERES HAN DENUNCIADO ABUSOS DURANTE PANDEMIA  La coordinadora de “Ecuménicas por el Derecho a Decidir”, Ana Ruth García, informó este miércoles que el Sistema de Emergencia 911 registra...  https://t.co/uUaCfwkX3n  https://t.co/6UxL78NQcF	es	[]	['https://youtu.be/lDJTEavGxzk']	['https://pbs.twimg.com/media/EntZSWTWEAEzzar.jpg']	1	1	3	[]	[]	https://twitter.com/hnellibertador/status/1331756294794076161	False		1	https://pbs.twimg.com/media/EntZSWTWEAEzzar.jpg	Honduras,Tegucigalpa						[]				
1331754096085315584	1331752048551976965	2020-11-25 19:18:13 -05	2020-11-25	19:18:13	-0500	1182452122463473664	royalonzo10	Roy Alonzo		@fer_rapalo9 Hummm ¡CUIDADO! los ligues de pandemia son nefastos 🚨	es	[]	[]	[]	1	0	0	[]	[]	https://twitter.com/RoyAlonzo10/status/1331754096085315584	False		0		Honduras,Tegucigalpa						[{'screen_name': 'fer_rapalo9', 'name': 'Fernanda Rápalo', 'id': '143618677'}]				
1331738451646017536	1331738451646017536	2020-11-25 18:16:04 -05	2020-11-25	18:16:04	-0500	58046607	procesodigital	Proceso Digital		#EEUU Biden pide unirse contra la pandemia mientras Trump sigue enredado en pleitos  https://t.co/rGB2ZF9mVX  https://t.co/DdrmBU62nE	es	[]	['https://bit.ly/3o1aMoX']	['https://pbs.twimg.com/media/EntJCGFXcAQzNRa.jpg']	0	0	0	['eeuu']	[]	https://twitter.com/ProcesoDigital/status/1331738451646017536	False		1	https://pbs.twimg.com/media/EntJCGFXcAQzNRa.jpg	Honduras,Tegucigalpa						[]				
1331704212355493888	1331704212355493888	2020-11-25 16:00:00 -05	2020-11-25	16:00:00	-0500	17548080	diarioelheraldo	Diario El Heraldo		La deserción afecta especialmente las escuelas y colegios públicos de zonas de escasos recursos, aunque también afecta a las escuelas privadas porque muchos padres se quedaron sin trabajo por la pandemia  #País #educacion #Honduras #Crisis    https://t.co/Y1GxN5D5Tc	es	[]	['https://www.elheraldo.hn/pais/1424781-466/millon-de-alumnos-abandonaron-aulas-por-covid']	[]	0	0	2	['país', 'educacion', 'honduras', 'crisis']	[]	https://twitter.com/diarioelheraldo/status/1331704212355493888	False		0		Honduras,Tegucigalpa						[]				
1331697683879354369	1331697683879354369	2020-11-25 15:34:04 -05	2020-11-25	15:34:04	-0500	1179027686976569346	andywagner30	Andrea Wagner		Tengo que aceptarlo, ME GUSTA MI EX.   -Pero mi ex vida antes de la pandemia.	es	[]	[]	[]	0	0	17	[]	[]	https://twitter.com/AndyWagner30/status/1331697683879354369	False		0		Honduras,Tegucigalpa						[]				
1331695295151878144	1331695295151878144	2020-11-25 15:24:34 -05	2020-11-25	15:24:34	-0500	3000008015	ueenhonduras	Unión Europea en Honduras		La emergencia sanitaria que vive el país por la pandemia y las consecuencias que las tormentas Eta e Iota han dejado en la población siguen impulsando el avance de la Ruta Solidaria del proyecto SER...  https://t.co/fg4uoV2YkP	es	[]	[]	['https://pbs.twimg.com/media/EnshzxYXYAAUkZ8.jpg', 'https://pbs.twimg.com/media/EnshzxVXMA00Oaz.jpg', 'https://pbs.twimg.com/media/EnshzxWW4AIyFLQ.jpg', 'https://pbs.twimg.com/media/EnshzyzXcAEJJLU.jpg']	2	1	4	[]	[]	https://twitter.com/UEenHonduras/status/1331695295151878144	False		1	https://pbs.twimg.com/media/EnshzxYXYAAUkZ8.jpg	Honduras,Tegucigalpa						[]				
1331690877606113281	1331690877606113281	2020-11-25 15:07:01 -05	2020-11-25	15:07:01	-0500	17548080	diarioelheraldo	Diario El Heraldo		En medio de la oscuridad mundial a causa de la pandemia de covid-19 se vislumbran cuatro rayos de luz y esperanza para evitar más muertes por la enfermedad.  #Vacunas #País #COVID19    https://t.co/w556HcWXDX	es	[]	['https://www.elheraldo.hn/pais/1424772-466/honduras-gestiona-38-millones-de-dosis-de-vacunas-para-covid-19']	[]	0	0	0	['vacunas', 'país', 'covid19']	[]	https://twitter.com/diarioelheraldo/status/1331690877606113281	False		0		Honduras,Tegucigalpa						[]				
1331672891923062789	1331672891923062789	2020-11-25 13:55:33 -05	2020-11-25	13:55:33	-0500	17548080	diarioelheraldo	Diario El Heraldo		Bruselas anunció el martes que firmará un contrato para hacerse con hasta 160 millones de dosis de la vacuna experimental desarrollada por Moderna  #pandemia #coronavirus #COVID19   https://t.co/sRKvD0INxV	es	[]	['https://www.elheraldo.hn/mundo/1424820-466/primeras-vacunas-contra-covid-19-llegaran-navidad-ue']	[]	0	0	3	['pandemia', 'coronavirus', 'covid19']	[]	https://twitter.com/diarioelheraldo/status/1331672891923062789	False		0		Honduras,Tegucigalpa						[]				
1331668885939105796	1331668885939105796	2020-11-25 13:39:38 -05	2020-11-25	13:39:38	-0500	1289658651423182849	girasol_tv	Girasol TV		#NoticiasDel47 | Vendedores de pólvora se encuentran listos para atender a la población, con las esperanzas de poder recuperarse de la crisis vivida por la pandemia del COVID-19, y ahora los estragos que dejaron Eta y Iota economicamente.   #GirasolMedios  https://t.co/TeZWuOpLcP	es	[]	[]	['https://pbs.twimg.com/media/EnsJy4JXcAArR2T.jpg']	0	0	0	['noticiasdel47', 'girasolmedios']	[]	https://twitter.com/girasol_tv/status/1331668885939105796	False		1	https://pbs.twimg.com/media/EnsJy4JXcAArR2T.jpg	Honduras,Tegucigalpa						[]				
1331667745931399170	1331583326071697411	2020-11-25 13:35:06 -05	2020-11-25	13:35:06	-0500	142550188	xiomaradanelia	Xiomara Orellana		@IndignadoLuis8 Cuídese mucho, la pandemia no da tregua.	es	[]	[]	[]	1	0	1	[]	[]	https://twitter.com/XiomaraDanelia/status/1331667745931399170	False		0		Honduras,Tegucigalpa						[{'screen_name': 'IndignadoLuis8', 'name': 'Indignado.', 'id': '1197585221027344384'}]				
1331657217754492935	1331657217754492935	2020-11-25 12:53:16 -05	2020-11-25	12:53:16	-0500	53966159	anagarciacarias	Ana García de Hernández		Recibo en nombre del gobierno de @JuanOrlandoH el segundo lote de equipo médico que dona el gobierno de #Japón 🇯🇵 para fortalecer el sistema de salud en combate a la pandemia   https://t.co/3TXGiGRlUm	es	[{'screen_name': 'juanorlandoh', 'name': 'juan orlando h.', 'id': '58244743'}]	['https://www.pscp.tv/w/co0_mjExNjM4ODA0fDFqTUtncFZxYnZQR0z5uIG3ezCUgfxS6FsiiC7FG9p5NCBnuq1H7kIZRGxTDg==']	[]	11	11	31	['japón']	[]	https://twitter.com/anagarciacarias/status/1331657217754492935	False		0		Honduras,Tegucigalpa						[]				
1331654163709775874	1331654163709775874	2020-11-25 12:41:08 -05	2020-11-25	12:41:08	-0500	53966159	anagarciacarias	Ana García de Hernández		Representé a @JuanOrlandoH en lanzamiento de plataforma virtual: “Conecta con tu seguridad y protección”,  diseñada para atender de manera remota casos de violencia contra las mujeres #Honduras; y como respuesta al aumento de denuncias por violencia, durante la pandemia.  https://t.co/0C5De9V83e	es	[{'screen_name': 'juanorlandoh', 'name': 'juan orlando h.', 'id': '58244743'}]	[]	['https://pbs.twimg.com/media/Enr8ZsYW8AM2Vvn.jpg', 'https://pbs.twimg.com/media/Enr8ZsXXYAQN2rM.jpg', 'https://pbs.twimg.com/media/Enr8ZsZWMAEFp1s.jpg', 'https://pbs.twimg.com/media/Enr8ZsaW8AAb-B5.jpg']	24	17	44	['honduras']	[]	https://twitter.com/anagarciacarias/status/1331654163709775874	False		1	https://pbs.twimg.com/media/Enr8ZsYW8AM2Vvn.jpg	Honduras,Tegucigalpa						[]				
1331651025221136384	1331651025221136384	2020-11-25 12:28:39 -05	2020-11-25	12:28:39	-0500	58046607	procesodigital	Proceso Digital		#Pandemia - Miami Beach vuelve a imponer multas a quienes no lleven mascarrillas  https://t.co/iuWfIEWw9w	es	[]	['https://bit.ly/3pUCwNU']	[]	0	0	1	['pandemia']	[]	https://twitter.com/ProcesoDigital/status/1331651025221136384	False		0		Honduras,Tegucigalpa						[]				
1331649741613096963	1331649741613096963	2020-11-25 12:23:33 -05	2020-11-25	12:23:33	-0500	1967437266	el_articulista	El Articulista		Pandemia de covid-19 sigue en alza en una Honduras destrozada por Iota y Eta  https://t.co/P0cgdjGZMw	es	[]	['https://ift.tt/2KFWXOB']	[]	0	0	0	[]	[]	https://twitter.com/EL_ARTICULISTA/status/1331649741613096963	False		0		Honduras,Tegucigalpa						[]				
1331643819373203459	1331643819373203459	2020-11-25 12:00:01 -05	2020-11-25	12:00:01	-0500	17548080	diarioelheraldo	Diario El Heraldo		Esos fondos serán utilizados para cubrir la crisis sanitaria de la pandemia del coronavirus y la reactivación de la economía hondureña.  #Economía #BCH #Honduras    https://t.co/1CPDyZXnQE	es	[]	['https://www.elheraldo.hn/economia/1424769-466/bch-presta-8350-millones-de-lempiras-a-la-sefin-para-presupuesto']	[]	0	0	2	['economía', 'bch', 'honduras']	[]	https://twitter.com/diarioelheraldo/status/1331643819373203459	False		0		Honduras,Tegucigalpa						[]				
1331639563375300613	1331639563375300613	2020-11-25 11:43:07 -05	2020-11-25	11:43:07	-0500	393105948	soyunceo	I'm CEO		Los de Amazon Prime, que estrenaban la serie de El Diego este año y tuvieron que retrasarla por la pandemia tiene los ojos así ahorita: 🤑  https://t.co/MoY3aSRTGv	es	[]	[]	['https://pbs.twimg.com/media/EnrvH7xXcAA4THu.jpg']	0	1	7	[]	[]	https://twitter.com/SoyUnCEO/status/1331639563375300613	False		1	https://pbs.twimg.com/media/EnrvH7xXcAA4THu.jpg	Honduras,Tegucigalpa						[]				
1331637793622253570	1331637793622253570	2020-11-25 11:36:05 -05	2020-11-25	11:36:05	-0500	1152775459	mariopinedav	Mario Rene Pineda V		1/3 La violencia contra las mujeres y las niñas es una pandemia mundial y un obstáculo importante para el desarrollo inclusivo, es por esto que es necesario empoderar a las mujeres en sus derechos para poner un alto a la violencia. ✋🏻☝🏻  https://t.co/3Xx8emmxpe	es	[]	[]	['https://pbs.twimg.com/media/Enrtg-1XYAQpykD.jpg']	1	8	25	[]	[]	https://twitter.com/mariopinedav/status/1331637793622253570	False		1	https://pbs.twimg.com/media/Enrtg-1XYAQpykD.jpg	Honduras,Tegucigalpa						[]				
1331637548993699842	1331637548993699842	2020-11-25 11:35:06 -05	2020-11-25	11:35:06	-0500	143954446	lokoxmotagua	Locos x Motagua.		El 2020 será un año para que las generaciones lo estudien y sea parte de la peor parte de la historia de la humanidad.  Pandemia. Huracanes. Corrupción a gran escala. Se nos fue el Diego de la gente.  https://t.co/RX6HFcPR6G	es	[]	[]	['https://pbs.twimg.com/media/EnrtSvuXIAA611o.jpg']	3	7	52	[]	[]	https://twitter.com/LOKOXMOTAGUA/status/1331637548993699842	False		1	https://pbs.twimg.com/media/EnrtSvuXIAA611o.jpg	Honduras,Tegucigalpa						[]				
1331635039550005250	1331635039550005250	2020-11-25 11:25:08 -05	2020-11-25	11:25:08	-0500	188534257	esdrasalopez	Esdras Amado Lopez		Seguimos solidarios con nuestros hermanos afectados por la pandemia y los fenómenos naturales que han golpeado a nuestro país. El periodista Ely Vallejo nos comparte estas imágenes que hablan mas que mil palabras.  https://t.co/Irwa0hmz91	es	[]	[]	['https://pbs.twimg.com/media/EnrrAVZWEAQC_98.jpg']	0	3	0	[]	[]	https://twitter.com/EsdrasALopez/status/1331635039550005250	False		1	https://pbs.twimg.com/media/EnrrAVZWEAQC_98.jpg	Honduras,Tegucigalpa						[]				
1331624535267962880	1331624535267962880	2020-11-25 10:43:24 -05	2020-11-25	10:43:24	-0500	195652137	paiz_roberto	P. Roberto Paiz C.		Ja ja ja, sí Señor a la cárcel y por favor, no molestar a los de Invests (por ejemplo Marco Bográn) ellos solo se robaron para alguno de sus jefes una cantidad de dinero que da miedo. Y el Congreso: Cuándo va actuar ante el dinero facilitado para contener la Pandemia?	es	[]	[]	[]	0	0	2	[]	[]	https://twitter.com/paiz_roberto/status/1331624535267962880	False	https://twitter.com/radioamericahn/status/1331370533427032064	0		Honduras,Tegucigalpa						[]				
1331623994206920706	1331623994206920706	2020-11-25 10:41:15 -05	2020-11-25	10:41:15	-0500	153178321	alexitac88	Miss Pandemia ♫ ♥		Respeten!!!!! (La vaso de leche) 🤣🤣🤣🤣  https://t.co/E8XaVqAAeF	es	[]	[]	['https://pbs.twimg.com/media/Enrg9yEXMAYlrHf.jpg']	0	0	2	[]	[]	https://twitter.com/AlexitaC88/status/1331623994206920706	False		1	https://pbs.twimg.com/media/Enrg9yEXMAYlrHf.jpg	Honduras,Tegucigalpa						[]				
1331601119005564929	1331591814541938692	2020-11-25 09:10:21 -05	2020-11-25	09:10:21	-0500	62594297	jacoprudot	Jaco		@FrenteaFrenteHN Quienes tienen al país sin salud, sin educación, sin oportunidades, quienes se han robado sin asco alguno los recursos necesarios para hacerle frente a la pandemia, la crisis económica y los huracanes, ¿AHORA SON LOS ENCARGADOS DE RECONSTRUIR? como decía DRE: #pelenmeeleje	es	[]	[]	[]	0	0	1	['pelenmeeleje']	[]	https://twitter.com/jacoprudot/status/1331601119005564929	False		0		Honduras,Tegucigalpa						[{'screen_name': 'FrenteaFrenteHN', 'name': 'Frente a Frente', 'id': '234511372'}]				
1331593509518905351	1331593509518905351	2020-11-25 08:40:07 -05	2020-11-25	08:40:07	-0500	972804638	televicentrohn	Televicentro HN		"El presidente Nayib Bukele dijo que este miércoles anunciará ""cómo vacunaremos a nuestra población y salir de una vez por todas de esta pandemia""   https://t.co/MqZFrwgLho"	es	[]	['https://www.tunota.com/nayib-bukele-el-salvador-firma-acuerdo-con-astrazeneca-para-el-suministro-de-2-millones-de-dosis-de-vacuna-contra-el-covid-19']	[]	0	1	1	[]	[]	https://twitter.com/televicentrohn/status/1331593509518905351	False		0		Honduras,Tegucigalpa						[]				
1331590811872604163	1331590811872604163	2020-11-25 08:29:23 -05	2020-11-25	08:29:23	-0500	17548080	diarioelheraldo	Diario El Heraldo		#LoÚltimo |  El ministro de #Finanzas Rishi Sunak, habló ante los diputados, anunciando que la ayuda al desarrollo se reduciría en 2021 al 0,5% de su Producto Interior Bruto (PIB) frente al 0,7% habitual, debido al golpe que la #pandemia ha asestado a sus finanzas públicas.  #UK  https://t.co/5fcx371M21	es	[]	[]	['https://pbs.twimg.com/media/EnrCvm3WEAMB4bX.jpg']	0	1	1	['loúltimo', 'finanzas', 'pandemia', 'uk']	[]	https://twitter.com/diarioelheraldo/status/1331590811872604163	False		1	https://pbs.twimg.com/media/EnrCvm3WEAMB4bX.jpg	Honduras,Tegucigalpa						[]				
1331583422641307648	1331583422641307648	2020-11-25 08:00:02 -05	2020-11-25	08:00:02	-0500	17548080	diarioelheraldo	Diario El Heraldo		La medida de movilidad abierta cumple su tercera semana consecutiva...  #honduras #pandemia #coronavirus #COVID19 #Tegucigalpa   https://t.co/GcLQqGDwvW	es	[]	['https://www.elheraldo.hn/tegucigalpa/1424538-466/sector-privado-pide-mantener-la-libre-circulaci%C3%B3n-por-la-econom%C3%ADa']	[]	0	0	1	['honduras', 'pandemia', 'coronavirus', 'covid19', 'tegucigalpa']	[]	https://twitter.com/diarioelheraldo/status/1331583422641307648	False		0		Honduras,Tegucigalpa						[]				
